,№ЭЧ,Класс_ЭЧ,Pclass,Name,Sex,Age,SibSp,Parch,Ticket,Fare,Cabin,Embarked,№ВК,№СИОМ
337,3380,1,1,"Burns, Miss. Elizabeth Margaret",female,41.0,0,0,16966,134.5,E40,C,3,380
316,3170,1,2,"Kantor, Mrs. Sinai (Miriam Sternin)",female,24.0,1,0,244367,26.0,,S,3,170
80,810,0,3,"Waelens, Mr. Achille",male,22.0,0,0,345767,9.0,,S,8,10
781,7820,1,1,"Dick, Mrs. Albert Adrian (Vera Gillespie)",female,17.0,1,0,17474,57.0,B20,S,7,820
167,1680,0,3,"Skoog, Mrs. William (Anna Bernhardina Karlsson)",female,45.0,1,4,347088,27.9,,S,1,680
131,1320,0,3,"Coelho, Mr. Domingos Fernandeo",male,20.0,0,0,SOTON/O.Q. 3101307,7.05,,S,1,320
591,5920,1,1,"Stephenson, Mrs. Walter Bertram (Martha Eustis)",female,52.0,1,0,36947,78.2667,D20,C,5,920
363,3640,0,3,"Asim, Mr. Adola",male,35.0,0,0,SOTON/O.Q. 3101310,7.05,,S,3,640
798,7990,0,3,"Ibrahim Shawah, Mr. Yousseff",male,30.0,0,0,2685,7.2292,,C,7,990
48,490,0,3,"Samaan, Mr. Youssef",male,,2,0,2662,21.6792,,C,4,90
224,2250,1,1,"Hoyt, Mr. Frederick Maxfield",male,38.0,1,0,19943,90.0,C93,S,2,250
240,2410,0,3,"Zabour, Miss. Thamine",female,,1,0,2665,14.4542,,C,2,410
806,8070,0,1,"Andrews, Mr. Thomas Jr",male,39.0,0,0,112050,0.0,A36,S,8,070
215,2160,1,1,"Newell, Miss. Madeleine",female,31.0,1,0,35273,113.275,D36,C,2,160
478,4790,0,3,"Karlsson, Mr. Nils August",male,22.0,0,0,350060,7.5208,,S,4,790
840,8410,0,3,"Alhomaki, Mr. Ilmari Rudolf",male,20.0,0,0,SOTON/O2 3101287,7.925,,S,8,410
708,7090,1,1,"Cleaver, Miss. Alice",female,22.0,0,0,113781,151.55,,S,7,090
315,3160,1,3,"Nilsson, Miss. Helmina Josefina",female,26.0,0,0,347470,7.8542,,S,3,160
875,8760,1,3,"Najib, Miss. Adele Kiamie ""Jane""",female,15.0,0,0,2667,7.225,,C,8,760
206,2070,0,3,"Backstrom, Mr. Karl Alfred",male,32.0,1,0,3101278,15.85,,S,2,070
257,2580,1,1,"Cherry, Miss. Gladys",female,30.0,0,0,110152,86.5,B77,S,2,580
98,990,1,2,"Doling, Mrs. John T (Ada Julia Bone)",female,34.0,0,1,231919,23.0,,S,9,90
573,5740,1,3,"Kelly, Miss. Mary",female,,0,0,14312,7.75,,Q,5,740
788,7890,1,3,"Dean, Master. Bertram Vere",male,1.0,1,2,C.A. 2315,20.575,,S,7,890
562,5630,0,2,"Norman, Mr. Robert Douglas",male,28.0,0,0,218629,13.5,,S,5,630
520,5210,1,1,"Perreault, Miss. Anne",female,30.0,0,0,12749,93.5,B73,S,5,210
212,2130,0,3,"Perkin, Mr. John Henry",male,22.0,0,0,A/5 21174,7.25,,S,2,130
436,4370,0,3,"Ford, Miss. Doolina Margaret ""Daisy""",female,21.0,2,2,W./C. 6608,34.375,,S,4,370
292,2930,0,2,"Levy, Mr. Rene Jacques",male,36.0,0,0,SC/Paris 2163,12.875,D,C,2,930
561,5620,0,3,"Sivic, Mr. Husein",male,40.0,0,0,349251,7.8958,,S,5,620
827,8280,1,2,"Mallet, Master. Andre",male,1.0,0,2,S.C./PARIS 2079,37.0042,,C,8,280
188,1890,0,3,"Bourke, Mr. John",male,40.0,1,1,364849,15.5,,Q,1,890
100,1010,0,3,"Petranec, Miss. Matilda",female,28.0,0,0,349245,7.8958,,S,1,010
346,3470,1,2,"Smith, Miss. Marion Elsie",female,40.0,0,0,31418,13.0,,S,3,470
697,6980,1,3,"Mullens, Miss. Katherine ""Katie""",female,,0,0,35852,7.7333,,Q,6,980
321,3220,0,3,"Danoff, Mr. Yoto",male,27.0,0,0,349219,7.8958,,S,3,220
310,3110,1,1,"Hays, Miss. Margaret Bechstein",female,24.0,0,0,11767,83.1583,C54,C,3,110
58,590,1,2,"West, Miss. Constance Mirium",female,5.0,1,2,C.A. 34651,27.75,,S,5,90
202,2030,0,3,"Johanson, Mr. Jakob Alfred",male,34.0,0,0,3101264,6.4958,,S,2,030
393,3940,1,1,"Newell, Miss. Marjorie",female,23.0,1,0,35273,113.275,D36,C,3,940
116,1170,0,3,"Connors, Mr. Patrick",male,70.5,0,0,370369,7.75,,Q,1,170
68,690,1,3,"Andersson, Miss. Erna Alexandra",female,17.0,4,2,3101281,7.925,,S,6,90
329,3300,1,1,"Hippach, Miss. Jean Gertrude",female,16.0,0,1,111361,57.9792,B18,C,3,300
67,680,0,3,"Crease, Mr. Ernest James",male,19.0,0,0,S.P. 3464,8.1583,,S,6,80
785,7860,0,3,"Harmer, Mr. Abraham (David Lishin)",male,25.0,0,0,374887,7.25,,S,7,860
498,4990,0,1,"Allison, Mrs. Hudson J C (Bessie Waldo Daniels)",female,25.0,1,2,113781,151.55,C22 C26,S,4,990
35,360,0,1,"Holverson, Mr. Alexander Oskar",male,42.0,1,0,113789,52.0,,S,3,60
173,1740,0,3,"Sivola, Mr. Antti Wilhelm",male,21.0,0,0,STON/O 2. 3101280,7.925,,S,1,740
223,2240,0,3,"Nenkoff, Mr. Christo",male,,0,0,349234,7.8958,,S,2,240
277,2780,0,2,"Parkes, Mr. Francis ""Frank""",male,,0,0,239853,0.0,,S,2,780
689,6900,1,1,"Madill, Miss. Georgette Alexandra",female,15.0,0,1,24160,211.3375,B5,S,6,900
129,1300,0,3,"Ekstrom, Mr. Johan",male,45.0,0,0,347061,6.975,,S,1,300
451,4520,0,3,"Hagland, Mr. Ingvald Olai Olsen",male,,1,0,65303,19.9667,,S,4,520
267,2680,1,3,"Persson, Mr. Ernst Ulrik",male,25.0,1,0,347083,7.775,,S,2,680
872,8730,0,1,"Carlsson, Mr. Frans Olof",male,33.0,0,0,695,5.0,B51 B53 B55,S,8,730
635,6360,1,2,"Davis, Miss. Mary",female,28.0,0,0,237668,13.0,,S,6,360
665,6660,0,2,"Hickman, Mr. Lewis",male,32.0,2,0,S.O.C. 14879,73.5,,S,6,660
889,8900,1,1,"Behr, Mr. Karl Howell",male,26.0,0,0,111369,30.0,C148,C,8,900
104,1050,0,3,"Gustafsson, Mr. Anders Vilhelm",male,37.0,2,0,3101276,7.925,,S,1,050
177,1780,0,1,"Isham, Miss. Ann Elizabeth",female,50.0,0,0,PC 17595,28.7125,C49,C,1,780
544,5450,0,1,"Douglas, Mr. Walter Donald",male,50.0,1,0,PC 17761,106.425,C86,C,5,450
680,6810,0,3,"Peters, Miss. Katie",female,,0,0,330935,8.1375,,Q,6,810
476,4770,0,2,"Renouf, Mr. Peter Henry",male,34.0,1,0,31027,21.0,,S,4,770
359,3600,1,3,"Mockler, Miss. Helen Mary ""Ellie""",female,,0,0,330980,7.8792,,Q,3,600
258,2590,1,1,"Ward, Miss. Anna",female,35.0,0,0,PC 17755,512.3292,,C,2,590
736,7370,0,3,"Ford, Mrs. Edward (Margaret Ann Watson)",female,48.0,1,3,W./C. 6608,34.375,,S,7,370
462,4630,0,1,"Gee, Mr. Arthur H",male,47.0,0,0,111320,38.5,E63,S,4,630
507,5080,1,1,"Bradley, Mr. George (""George Arthur Brayton"")",male,,0,0,111427,26.55,,S,5,080
