,№ЭЧ,Класс_ЭЧ,Pclass,Name,Sex,Age,SibSp,Parch,Ticket,Fare,Cabin,Embarked,№ВК,№СИОМ
47,480,1,3,"O'Driscoll, Miss. Bridget",female,,0,0,14311,7.75,,Q,4,80
70,710,0,2,"Jenkin, Mr. Stephen Curnow",male,32.0,0,0,C.A. 33111,10.5,,S,7,10
682,6830,0,3,"Olsvigen, Mr. Thor Anderson",male,20.0,0,0,6563,9.225,,S,6,830
377,3780,0,1,"Widener, Mr. Harry Elkins",male,27.0,0,2,113503,211.5,C82,C,3,780
123,1240,1,2,"Webber, Miss. Susan",female,32.5,0,0,27267,13.0,E101,S,1,240
194,1950,1,1,"Brown, Mrs. James Joseph (Margaret Tobin)",female,44.0,0,0,PC 17610,27.7208,B4,C,1,950
135,1360,0,2,"Richard, Mr. Emile",male,23.0,0,0,SC/PARIS 2133,15.0458,,C,1,360
616,6170,0,3,"Danbom, Mr. Ernst Gilbert",male,34.0,1,1,347080,14.4,,S,6,170
543,5440,1,2,"Beane, Mr. Edward",male,32.0,1,0,2908,26.0,,S,5,440
445,4460,1,1,"Dodge, Master. Washington",male,4.0,0,2,33638,81.8583,A34,S,4,460
119,1200,0,3,"Andersson, Miss. Ellis Anna Maria",female,2.0,4,2,347082,31.275,,S,1,200
413,4140,0,2,"Cunningham, Mr. Alfred Fleming",male,,0,0,239853,0.0,,S,4,140
343,3440,0,2,"Sedgwick, Mr. Charles Frederick Waddington",male,25.0,0,0,244361,13.0,,S,3,440
89,900,0,3,"Celotti, Mr. Francesco",male,24.0,0,0,343275,8.05,,S,9,00
836,8370,0,3,"Pasic, Mr. Jakob",male,21.0,0,0,315097,8.6625,,S,8,370
439,4400,0,2,"Kvillner, Mr. Johan Henrik Johannesson",male,31.0,0,0,C.A. 18723,10.5,,S,4,400
317,3180,0,2,"Moraweck, Dr. Ernest",male,54.0,0,0,29011,14.0,,S,3,180
85,860,1,3,"Backstrom, Mrs. Karl Alfred (Maria Mathilda Gustafsson)",female,33.0,3,0,3101278,15.85,,S,8,60
733,7340,0,2,"Berriman, Mr. William John",male,23.0,0,0,28425,13.0,,S,7,340
145,1460,0,2,"Nicholls, Mr. Joseph Charles",male,19.0,1,1,C.A. 33112,36.75,,S,1,460
280,2810,0,3,"Duane, Mr. Frank",male,65.0,0,0,336439,7.75,,Q,2,810
490,4910,0,3,"Hagland, Mr. Konrad Mathias Reiersen",male,,1,0,65304,19.9667,,S,4,910
865,8660,1,2,"Bystrom, Mrs. (Karolina)",female,42.0,0,0,236852,13.0,,S,8,660
144,1450,0,2,"Andrew, Mr. Edgardo Samuel",male,18.0,0,0,231945,11.5,,S,1,450
221,2220,0,2,"Bracken, Mr. James H",male,27.0,0,0,220367,13.0,,S,2,220
124,1250,0,1,"White, Mr. Percival Wayland",male,54.0,0,1,35281,77.2875,D26,S,1,250
524,5250,0,3,"Kassem, Mr. Fared",male,,0,0,2700,7.2292,,C,5,250
110,1110,0,1,"Porter, Mr. Walter Chamberlain",male,47.0,0,0,110465,52.0,C110,S,1,110
59,600,0,3,"Goodwin, Master. William Frederick",male,11.0,5,2,CA 2144,46.9,,S,6,00
120,1210,0,2,"Hickman, Mr. Stanley George",male,21.0,2,0,S.O.C. 14879,73.5,,S,1,210
242,2430,0,2,"Coleridge, Mr. Reginald Charles",male,29.0,0,0,W./C. 14263,10.5,,S,2,430
811,8120,0,3,"Lester, Mr. James",male,39.0,0,0,A/4 48871,24.15,,S,8,120
885,8860,0,3,"Rice, Mrs. William (Margaret Norton)",female,39.0,0,5,382652,29.125,,Q,8,860
605,6060,0,3,"Lindell, Mr. Edvard Bengtsson",male,36.0,1,0,349910,15.55,,S,6,060
307,3080,1,1,"Penasco y Castellana, Mrs. Victor de Satode (Maria Josefa Perez de Soto y Vallejo)",female,17.0,1,0,PC 17758,108.9,C65,C,3,080
158,1590,0,3,"Smiljanic, Mr. Mile",male,,0,0,315037,8.6625,,S,1,590
542,5430,0,3,"Andersson, Miss. Sigrid Elisabeth",female,11.0,4,2,347082,31.275,,S,5,430
132,1330,0,3,"Robins, Mrs. Alexander A (Grace Charity Laury)",female,47.0,1,0,A/5. 3337,14.5,,S,1,330
284,2850,0,1,"Smith, Mr. Richard William",male,,0,0,113056,26.0,A19,S,2,850
25,260,1,3,"Asplund, Mrs. Carl Oscar (Selma Augusta Emilia Johansson)",female,38.0,1,5,347077,31.3875,,S,2,60
303,3040,1,2,"Keane, Miss. Nora A",female,,0,0,226593,12.35,E101,Q,3,040
887,8880,1,1,"Graham, Miss. Margaret Edith",female,19.0,0,0,112053,30.0,B42,S,8,880
556,5570,1,1,"Duff Gordon, Lady. (Lucille Christiana Sutherland) (""Mrs Morgan"")",female,48.0,1,0,11755,39.6,A16,C,5,570
778,7790,0,3,"Kilgannon, Mr. Thomas J",male,,0,0,36865,7.7375,,Q,7,790
31,320,1,1,"Spencer, Mrs. William Augustus (Marie Eugenie)",female,,1,0,PC 17569,146.5208,B78,C,3,20
263,2640,0,1,"Harrison, Mr. William",male,40.0,0,0,112059,0.0,B94,S,2,640
805,8060,0,3,"Johansson, Mr. Karl Johan",male,31.0,0,0,347063,7.775,,S,8,060
24,250,0,3,"Palsson, Miss. Torborg Danira",female,8.0,3,1,349909,21.075,,S,2,50
207,2080,1,3,"Albimona, Mr. Nassef Cassem",male,26.0,0,0,2699,18.7875,,C,2,080
655,6560,0,2,"Hickman, Mr. Leonard Mark",male,24.0,2,0,S.O.C. 14879,73.5,,S,6,560
60,610,0,3,"Sirayanian, Mr. Orsen",male,22.0,0,0,2669,7.2292,,C,6,10
750,7510,1,2,"Wells, Miss. Joan",female,4.0,1,1,29103,23.0,,S,7,510
187,1880,1,1,"Romaine, Mr. Charles Hallace (""Mr C Rolmane"")",male,45.0,0,0,111428,26.55,,S,1,880
380,3810,1,1,"Bidois, Miss. Rosalie",female,42.0,0,0,PC 17757,227.525,,C,3,810
632,6330,1,1,"Stahelin-Maeglin, Dr. Max",male,32.0,0,0,13214,30.5,B50,C,6,330
222,2230,0,3,"Green, Mr. George Henry",male,51.0,0,0,21440,8.05,,S,2,230
111,1120,0,3,"Zabour, Miss. Hileni",female,14.5,1,0,2665,14.4542,,C,1,120
611,6120,0,3,"Jardin, Mr. Jose Neto",male,,0,0,SOTON/O.Q. 3101305,7.05,,S,6,120
620,6210,0,3,"Yasbeck, Mr. Antoni",male,27.0,1,0,2659,14.4542,,C,6,210
711,7120,0,1,"Klaber, Mr. Herman",male,,0,0,113028,26.55,C124,S,7,120
787,7880,0,3,"Rice, Master. George Hugh",male,8.0,4,1,382652,29.125,,Q,7,880
217,2180,0,2,"Jacobsohn, Mr. Sidney Samuel",male,42.0,1,0,243847,27.0,,S,2,180
319,3200,1,1,"Spedden, Mrs. Frederic Oakley (Margaretta Corning Stone)",female,40.0,1,1,16966,134.5,E34,C,3,200
233,2340,1,3,"Asplund, Miss. Lillian Gertrud",female,5.0,4,2,347077,31.3875,,S,2,340
606,6070,0,3,"Karaic, Mr. Milan",male,30.0,0,0,349246,7.8958,,S,6,070
274,2750,1,3,"Healy, Miss. Hanora ""Nora""",female,,0,0,370375,7.75,,Q,2,750
171,1720,0,3,"Rice, Master. Arthur",male,4.0,4,1,382652,29.125,,Q,1,720
831,8320,1,2,"Richards, Master. George Sibley",male,0.83,1,1,29106,18.75,,S,8,320
426,4270,1,2,"Clarke, Mrs. Charles V (Ada Maria Winfield)",female,28.0,1,0,2003,26.0,,S,4,270
378,3790,0,3,"Betros, Mr. Tannous",male,20.0,0,0,2648,4.0125,,C,3,790
26,270,0,3,"Emir, Mr. Farred Chehab",male,,0,0,2631,7.225,,C,2,70
793,7940,0,1,"Hoyt, Mr. William Fisher",male,,0,0,PC 17600,30.6958,,C,7,940
163,1640,0,3,"Calic, Mr. Jovo",male,17.0,0,0,315093,8.6625,,S,1,640
584,5850,0,3,"Paulner, Mr. Uscher",male,,0,0,3411,8.7125,,C,5,850
231,2320,0,3,"Larsson, Mr. Bengt Edvin",male,29.0,0,0,347067,7.775,,S,2,320
590,5910,0,3,"Rintamaki, Mr. Matti",male,35.0,0,0,STON/O 2. 3101273,7.125,,S,5,910
813,8140,0,3,"Andersson, Miss. Ebba Iris Alfrida",female,6.0,4,2,347082,31.275,,S,8,140
44,450,1,3,"Devaney, Miss. Margaret Delia",female,19.0,0,0,330958,7.8792,,Q,4,50
623,6240,0,3,"Hansen, Mr. Henry Damsgaard",male,21.0,0,0,350029,7.8542,,S,6,240
876,8770,0,3,"Gustafsson, Mr. Alfred Ossian",male,20.0,0,0,7534,9.8458,,S,8,770
535,5360,1,2,"Hart, Miss. Eva Miriam",female,7.0,0,2,F.C.C. 13529,26.25,,S,5,360
400,4010,1,3,"Niskanen, Mr. Juha",male,39.0,0,0,STON/O 2. 3101289,7.925,,S,4,010
73,740,0,3,"Chronopoulos, Mr. Apostolos",male,26.0,1,0,2680,14.4542,,C,7,40
362,3630,0,3,"Barbara, Mrs. (Catherine David)",female,45.0,0,1,2691,14.4542,,C,3,630
548,5490,0,3,"Goldsmith, Mr. Frank John",male,33.0,1,1,363291,20.525,,S,5,490
340,3410,1,2,"Navratil, Master. Edmond Roger",male,2.0,1,1,230080,26.0,F2,S,3,410
849,8500,1,1,"Goldenberg, Mrs. Samuel L (Edwiga Grabowska)",female,,1,0,17453,89.1042,C92,C,8,500
617,6180,0,3,"Lobb, Mrs. William Arthur (Cordelia K Stanlick)",female,26.0,1,0,A/5. 3336,16.1,,S,6,180
838,8390,1,3,"Chip, Mr. Chang",male,32.0,0,0,1601,56.4958,,S,8,390
269,2700,1,1,"Bissette, Miss. Amelia",female,35.0,0,0,PC 17760,135.6333,C99,S,2,700
423,4240,0,3,"Danbom, Mrs. Ernst Gilbert (Anna Sigrid Maria Brogren)",female,28.0,1,1,347080,14.4,,S,4,240
13,140,0,3,"Andersson, Mr. Anders Johan",male,39.0,1,5,347082,31.275,,S,1,40
355,3560,0,3,"Vanden Steen, Mr. Leo Peter",male,28.0,0,0,345783,9.5,,S,3,560
273,2740,0,1,"Natsch, Mr. Charles H",male,37.0,0,1,PC 17596,29.7,C118,C,2,740
425,4260,0,3,"Wiseman, Mr. Phillippe",male,,0,0,A/4. 34244,7.25,,S,4,260
850,8510,0,3,"Andersson, Master. Sigvard Harald Elias",male,4.0,4,2,347082,31.275,,S,8,510
97,980,1,1,"Greenfield, Mr. William Bertram",male,23.0,0,1,PC 17759,63.3583,D10 D12,C,9,80
465,4660,0,3,"Goncalves, Mr. Manuel Estanslas",male,38.0,0,0,SOTON/O.Q. 3101306,7.05,,S,4,660
784,7850,0,3,"Ali, Mr. William",male,25.0,0,0,SOTON/O.Q. 3101312,7.05,,S,7,850
66,670,1,2,"Nye, Mrs. (Elizabeth Ramell)",female,29.0,0,0,C.A. 29395,10.5,F33,S,6,70
6,70,0,1,"McCarthy, Mr. Timothy J",male,54.0,0,0,17463,51.8625,E46,S,7,0
247,2480,1,2,"Hamalainen, Mrs. William (Anna)",female,24.0,0,2,250649,14.5,,S,2,480
313,3140,0,3,"Hendekovic, Mr. Ignjac",male,28.0,0,0,349243,7.8958,,S,3,140
533,5340,1,3,"Peter, Mrs. Catherine (Catherine Rizk)",female,,0,2,2668,22.3583,,C,5,340
14,150,0,3,"Vestrom, Miss. Hulda Amanda Adolfina",female,14.0,0,0,350406,7.8542,,S,1,50
272,2730,1,2,"Mellinger, Mrs. (Elizabeth Anne Maidment)",female,41.0,0,1,250644,19.5,,S,2,730
538,5390,0,3,"Risien, Mr. Samuel Beard",male,,0,0,364498,14.5,,S,5,390
526,5270,1,2,"Ridsdale, Miss. Lucy",female,50.0,0,0,W./C. 14258,10.5,,S,5,270
568,5690,0,3,"Doharr, Mr. Tannous",male,,0,0,2686,7.2292,,C,5,690
408,4090,0,3,"Birkeland, Mr. Hans Martin Monsen",male,21.0,0,0,312992,7.775,,S,4,090
539,5400,1,1,"Frolicher, Miss. Hedwig Margaritha",female,22.0,0,2,13568,49.5,B39,C,5,400
514,5150,0,3,"Coleff, Mr. Satio",male,24.0,0,0,349209,7.4958,,S,5,150
56,570,1,2,"Rugg, Miss. Emily",female,21.0,0,0,C.A. 31026,10.5,,S,5,70
631,6320,0,3,"Lundahl, Mr. Johan Svensson",male,51.0,0,0,347743,7.0542,,S,6,320
600,6010,1,2,"Jacobsohn, Mrs. Sidney Samuel (Amy Frances Christy)",female,24.0,2,1,243847,27.0,,S,6,010
191,1920,0,2,"Carbines, Mr. William",male,19.0,0,0,28424,13.0,,S,1,920
112,1130,0,3,"Barton, Mr. David John",male,22.0,0,0,324669,8.05,,S,1,130
170,1710,0,1,"Van der hoef, Mr. Wyckoff",male,61.0,0,0,111240,33.5,B19,S,1,710
464,4650,0,3,"Maisner, Mr. Simon",male,,0,0,A/S 2816,8.05,,S,4,650
687,6880,0,3,"Dakic, Mr. Branko",male,19.0,0,0,349228,10.1708,,S,6,880
95,960,0,3,"Shorney, Mr. Charles Joseph",male,,0,0,374910,8.05,,S,9,60
289,2900,1,3,"Connolly, Miss. Kate",female,22.0,0,0,370373,7.75,,Q,2,900
508,5090,0,3,"Olsen, Mr. Henry Margido",male,28.0,0,0,C 4001,22.525,,S,5,090
774,7750,1,2,"Hocking, Mrs. Elizabeth (Eliza Needs)",female,54.0,1,3,29105,23.0,,S,7,750
761,7620,0,3,"Nirva, Mr. Iisakki Antino Aijo",male,41.0,0,0,SOTON/O2 3101272,7.125,,S,7,620
57,580,0,3,"Novel, Mr. Mansouer",male,28.5,0,0,2697,7.2292,,C,5,80
420,4210,0,3,"Gheorgheff, Mr. Stanio",male,,0,0,349254,7.8958,,C,4,210
861,8620,0,2,"Giles, Mr. Frederick Edward",male,21.0,1,0,28134,11.5,,S,8,620
670,6710,1,2,"Brown, Mrs. Thomas William Solomon (Elizabeth Catherine Ford)",female,40.0,1,1,29750,39.0,,S,6,710
265,2660,0,2,"Reeves, Mr. David",male,36.0,0,0,C.A. 17248,10.5,,S,2,660
53,540,1,2,"Faunthorpe, Mrs. Lizzie (Elizabeth Anne Wilkinson)",female,29.0,1,0,2926,26.0,,S,5,40
830,8310,1,3,"Yasbeck, Mrs. Antoni (Selini Alexander)",female,15.0,1,0,2659,14.4542,,C,8,310
525,5260,0,3,"Farrell, Mr. James",male,40.5,0,0,367232,7.75,,Q,5,260
510,5110,1,3,"Daly, Mr. Eugene Patrick",male,29.0,0,0,382651,7.75,,Q,5,110
506,5070,1,2,"Quick, Mrs. Frederick Charles (Jane Richards)",female,33.0,0,2,26360,26.0,,S,5,070
372,3730,0,3,"Beavan, Mr. William Thomas",male,19.0,0,0,323951,8.05,,S,3,730
812,8130,0,2,"Slemen, Mr. Richard James",male,35.0,0,0,28206,10.5,,S,8,130
311,3120,1,1,"Ryerson, Miss. Emily Borie",female,18.0,2,2,PC 17608,262.375,B57 B59 B63 B66,C,3,120
49,500,0,3,"Arnold-Franchi, Mrs. Josef (Josefine Franchi)",female,18.0,1,0,349237,17.8,,S,5,00
602,6030,0,1,"Harrington, Mr. Charles H",male,,0,0,113796,42.4,,S,6,030
629,6300,0,3,"O'Connell, Mr. Patrick D",male,,0,0,334912,7.7333,,Q,6,300
589,5900,0,3,"Murdlin, Mr. Joseph",male,,0,0,A./5. 3235,8.05,,S,5,900
102,1030,0,1,"White, Mr. Richard Frasar",male,21.0,0,1,35281,77.2875,D26,S,1,030
653,6540,1,3,"O'Leary, Miss. Hanora ""Norah""",female,,0,0,330919,7.8292,,Q,6,540
581,5820,1,1,"Thayer, Mrs. John Borland (Marian Longstreth Morris)",female,39.0,1,1,17421,110.8833,C68,C,5,820
640,6410,0,3,"Jensen, Mr. Hans Peder",male,20.0,0,0,350050,7.8542,,S,6,410
487,4880,0,1,"Kent, Mr. Edward Austin",male,58.0,0,0,11771,29.7,B37,C,4,880
599,6000,1,1,"Duff Gordon, Sir. Cosmo Edmund (""Mr Morgan"")",male,49.0,1,0,PC 17485,56.9292,A20,C,6,000
448,4490,1,3,"Baclini, Miss. Marie Catherine",female,5.0,2,1,2666,19.2583,,C,4,490
558,5590,1,1,"Taussig, Mrs. Emil (Tillie Mandelbaum)",female,39.0,1,1,110413,79.65,E67,S,5,590
500,5010,0,3,"Calic, Mr. Petar",male,17.0,0,0,315086,8.6625,,S,5,010
54,550,0,1,"Ostby, Mr. Engelhart Cornelius",male,65.0,0,1,113509,61.9792,B30,C,5,50
334,3350,1,1,"Frauenthal, Mrs. Henry William (Clara Heinsheimer)",female,,1,0,PC 17611,133.65,,S,3,350
306,3070,1,1,"Fleming, Miss. Margaret",female,,0,0,17421,110.8833,,C,3,070
37,380,0,3,"Cann, Mr. Ernest Charles",male,21.0,0,0,A./5. 2152,8.05,,S,3,80
867,8680,0,1,"Roebling, Mr. Washington Augustus II",male,31.0,0,0,PC 17590,50.4958,A24,S,8,680
579,5800,1,3,"Jussila, Mr. Eiriik",male,32.0,0,0,STON/O 2. 3101286,7.925,,S,5,800
795,7960,0,2,"Otter, Mr. Richard",male,39.0,0,0,28213,13.0,,S,7,960
12,130,0,3,"Saundercock, Mr. William Henry",male,20.0,0,0,A/5. 2151,8.05,,S,1,30
21,220,1,2,"Beesley, Mr. Lawrence",male,34.0,0,0,248698,13.0,D56,S,2,20
662,6630,0,1,"Colley, Mr. Edward Pomeroy",male,47.0,0,0,5727,25.5875,E58,S,6,630
512,5130,1,1,"McGough, Mr. James Robert",male,36.0,0,0,PC 17473,26.2875,E25,S,5,130
624,6250,0,3,"Bowen, Mr. David John ""Dai""",male,21.0,0,0,54636,16.1,,S,6,250
454,4550,0,3,"Peduzzi, Mr. Joseph",male,,0,0,A/5 2817,8.05,,S,4,550
335,3360,0,3,"Denkoff, Mr. Mitto",male,,0,0,349225,7.8958,,S,3,360
534,5350,0,3,"Cacic, Miss. Marija",female,30.0,0,0,315084,8.6625,,S,5,350
76,770,0,3,"Staneff, Mr. Ivan",male,,0,0,349208,7.8958,,S,7,70
522,5230,0,3,"Lahoud, Mr. Sarkis",male,,0,0,2624,7.225,,C,5,230
103,1040,0,3,"Johansson, Mr. Gustaf Joel",male,33.0,0,0,7540,8.6542,,S,1,040
309,3100,1,1,"Francatelli, Miss. Laura Mabel",female,30.0,0,0,PC 17485,56.9292,E36,C,3,100
183,1840,1,2,"Becker, Master. Richard F",male,1.0,2,1,230136,39.0,F4,S,1,840
404,4050,0,3,"Oreskovic, Miss. Marija",female,20.0,0,0,315096,8.6625,,S,4,050
416,4170,1,2,"Drew, Mrs. James Vivian (Lulu Thorne Christian)",female,34.0,1,1,28220,32.5,,S,4,170
339,3400,0,1,"Blackwell, Mr. Stephen Weart",male,45.0,0,0,113784,35.5,T,S,3,400
327,3280,1,2,"Ball, Mrs. (Ada E Hall)",female,36.0,0,0,28551,13.0,D,S,3,280
528,5290,0,3,"Salonen, Mr. Johan Werner",male,39.0,0,0,3101296,7.925,,S,5,290
622,6230,1,3,"Nakid, Mr. Sahid",male,20.0,1,1,2653,15.7417,,C,6,230
843,8440,0,3,"Lemberopolous, Mr. Peter L",male,34.5,0,0,2683,6.4375,,C,8,440
200,2010,0,3,"Vande Walle, Mr. Nestor Cyriel",male,28.0,0,0,345770,9.5,,S,2,010
301,3020,1,3,"McCoy, Mr. Bernard",male,,2,0,367226,23.25,,Q,3,020
304,3050,0,3,"Williams, Mr. Howard Hugh ""Harry""",male,,0,0,A/5 2466,8.05,,S,3,050
419,4200,0,3,"Van Impe, Miss. Catharina",female,10.0,0,2,345773,24.15,,S,4,200
852,8530,0,3,"Boulos, Miss. Nourelain",female,9.0,1,1,2678,15.2458,,C,8,530
101,1020,0,3,"Petroff, Mr. Pastcho (""Pentcho"")",male,,0,0,349215,7.8958,,S,1,020
227,2280,0,3,"Lovell, Mr. John Hall (""Henry"")",male,20.5,0,0,A/5 21173,7.25,,S,2,280
669,6700,1,1,"Taylor, Mrs. Elmer Zebley (Juliet Cummins Wright)",female,,1,0,19996,52.0,C126,S,6,700
325,3260,1,1,"Young, Miss. Marie Grice",female,36.0,0,0,PC 17760,135.6333,C32,C,3,260
837,8380,0,3,"Sirota, Mr. Maurice",male,,0,0,392092,8.05,,S,8,380
648,6490,0,3,"Willey, Mr. Edward",male,,0,0,S.O./P.P. 751,7.55,,S,6,490
725,7260,0,3,"Oreskovic, Mr. Luka",male,20.0,0,0,315094,8.6625,,S,7,260
882,8830,0,3,"Dahlberg, Miss. Gerda Ulrika",female,22.0,0,0,7552,10.5167,,S,8,830
808,8090,0,2,"Meyer, Mr. August",male,39.0,0,0,248723,13.0,,S,8,090
503,5040,0,3,"Laitinen, Miss. Kristina Sofia",female,37.0,0,0,4135,9.5875,,S,5,040
754,7550,1,2,"Herman, Mrs. Samuel (Jane Laver)",female,48.0,1,2,220845,65.0,,S,7,550
658,6590,0,2,"Eitemiller, Mr. George Floyd",male,23.0,0,0,29751,13.0,,S,6,590
727,7280,1,3,"Mannion, Miss. Margareth",female,,0,0,36866,7.7375,,Q,7,280
672,6730,0,2,"Mitchell, Mr. Henry Michael",male,70.0,0,0,C.A. 24580,10.5,,S,6,730
657,6580,0,3,"Bourke, Mrs. John (Catherine)",female,32.0,1,1,364849,15.5,,Q,6,580
746,7470,0,3,"Abbott, Mr. Rossmore Edward",male,16.0,1,1,C.A. 2673,20.25,,S,7,470
72,730,0,2,"Hood, Mr. Ambrose Jr",male,21.0,0,0,S.O.C. 14879,73.5,,S,7,30
470,4710,0,3,"Keefe, Mr. Arthur",male,,0,0,323592,7.25,,S,4,710
149,1500,0,2,"Byles, Rev. Thomas Roussel Davids",male,42.0,0,0,244310,13.0,,S,1,500
499,5000,0,3,"Svensson, Mr. Olof",male,24.0,0,0,350035,7.7958,,S,5,000
141,1420,1,3,"Nysten, Miss. Anna Sofia",female,22.0,0,0,347081,7.75,,S,1,420
661,6620,0,3,"Badt, Mr. Mohamed",male,40.0,0,0,2623,7.225,,C,6,620
305,3060,1,1,"Allison, Master. Hudson Trevor",male,0.92,1,2,113781,151.55,C22 C26,S,3,060
285,2860,0,3,"Stankovic, Mr. Ivan",male,33.0,0,0,349239,8.6625,,C,2,860
675,6760,0,3,"Edvardsson, Mr. Gustaf Hjalmar",male,18.0,0,0,349912,7.775,,S,6,760
169,1700,0,3,"Ling, Mr. Lee",male,28.0,0,0,1601,56.4958,,S,1,700
594,5950,0,2,"Chapman, Mr. John Henry",male,37.0,1,0,SC/AH 29037,26.0,,S,5,950
777,7780,1,3,"Emanuel, Miss. Virginia Ethel",female,5.0,0,0,364516,12.475,,S,7,780
780,7810,1,3,"Ayoub, Miss. Banoura",female,13.0,0,0,2687,7.2292,,C,7,810
551,5520,0,2,"Sharp, Mr. Percival James R",male,27.0,0,0,244358,26.0,,S,5,520
357,3580,0,2,"Funk, Miss. Annie Clemmer",female,38.0,0,0,237671,13.0,,S,3,580
845,8460,0,3,"Abbing, Mr. Anthony",male,42.0,0,0,C.A. 5547,7.55,,S,8,460
348,3490,1,3,"Coutts, Master. William Loch ""William""",male,3.0,1,1,C.A. 37671,15.9,,S,3,490
399,4000,1,2,"Trout, Mrs. William H (Jessie L)",female,28.0,0,0,240929,12.65,,S,4,000
299,3000,1,1,"Baxter, Mrs. James (Helene DeLaudeniere Chaput)",female,50.0,0,1,PC 17558,247.5208,B58 B60,C,3,000
857,8580,1,1,"Daly, Mr. Peter Denis ",male,51.0,0,0,113055,26.55,E17,S,8,580
859,8600,0,3,"Razi, Mr. Raihed",male,,0,0,2629,7.2292,,C,8,600
290,2910,1,1,"Barber, Miss. Ellen ""Nellie""",female,26.0,0,0,19877,78.85,,S,2,910
650,6510,0,3,"Mitkoff, Mr. Mito",male,,0,0,349221,7.8958,,S,6,510
710,7110,1,1,"Mayne, Mlle. Berthe Antonine (""Mrs de Villiers"")",female,24.0,0,0,PC 17482,49.5042,C90,C,7,110
621,6220,1,1,"Kimball, Mr. Edwin Nelson Jr",male,42.0,1,0,11753,52.5542,D19,S,6,220
707,7080,1,1,"Calderhead, Mr. Edward Pennington",male,42.0,0,0,PC 17476,26.2875,E24,S,7,080
384,3850,0,3,"Plotcharsky, Mr. Vasil",male,,0,0,349227,7.8958,,S,3,850
450,4510,0,2,"West, Mr. Edwy Arthur",male,36.0,1,2,C.A. 34651,27.75,,S,4,510
136,1370,1,1,"Newsom, Miss. Helen Monypeny",female,19.0,0,2,11752,26.2833,D47,S,1,370
863,8640,0,3,"Sage, Miss. Dorothy Edith ""Dolly""",female,,8,2,CA. 2343,69.55,,S,8,640
456,4570,0,1,"Millet, Mr. Francis Davis",male,65.0,0,0,13509,26.55,E38,S,4,570
22,230,1,3,"McGowan, Miss. Anna ""Annie""",female,15.0,0,0,330923,8.0292,,Q,2,30
19,200,1,3,"Masselmani, Mrs. Fatima",female,,0,0,2649,7.225,,C,2,00
789,7900,0,1,"Guggenheim, Mr. Benjamin",male,46.0,0,0,PC 17593,79.2,B82 B84,C,7,900
83,840,0,1,"Carrau, Mr. Francisco M",male,28.0,0,0,113059,47.1,,S,8,40
259,2600,1,2,"Parrish, Mrs. (Lutie Davis)",female,50.0,0,1,230433,26.0,,S,2,600
291,2920,1,1,"Bishop, Mrs. Dickinson H (Helen Walton)",female,19.0,1,0,11967,91.0792,B49,C,2,920
109,1100,1,3,"Moran, Miss. Bertha",female,,1,0,371110,24.15,,Q,1,100
370,3710,1,1,"Harder, Mr. George Achilles",male,25.0,1,0,11765,55.4417,E50,C,3,710
829,8300,1,1,"Stone, Mrs. George Nelson (Martha Evelyn)",female,62.0,0,0,113572,80.0,B28,,8,300
724,7250,1,1,"Chambers, Mr. Norman Campbell",male,27.0,1,0,113806,53.1,E8,S,7,250
486,4870,1,1,"Hoyt, Mrs. Frederick Maxfield (Jane Anne Forby)",female,35.0,1,0,19943,90.0,C93,S,4,870
497,4980,0,3,"Shellard, Mr. Frederick William",male,,0,0,C.A. 6212,15.1,,S,4,980
699,7000,0,3,"Humblen, Mr. Adolf Mathias Nicolai Olsen",male,42.0,0,0,348121,7.65,F G63,S,7,000
42,430,0,3,"Kraeff, Mr. Theodor",male,,0,0,349253,7.8958,,C,4,30
457,4580,1,1,"Kenyon, Mrs. Frederick R (Marion)",female,,1,0,17464,51.8625,D21,S,4,580
210,2110,0,3,"Ali, Mr. Ahmed",male,24.0,0,0,SOTON/O.Q. 3101311,7.05,,S,2,110
127,1280,1,3,"Madsen, Mr. Fridtjof Arne",male,24.0,0,0,C 17369,7.1417,,S,1,280
618,6190,1,2,"Becker, Miss. Marion Louise",female,4.0,2,1,230136,39.0,F4,S,6,190
443,4440,1,2,"Reynaldo, Ms. Encarnacion",female,28.0,0,0,230434,13.0,,S,4,440
385,3860,0,2,"Davies, Mr. Charles Henry",male,18.0,0,0,S.O.C. 14879,73.5,,S,3,860
8,90,1,3,"Johnson, Mrs. Oscar W (Elisabeth Vilhelmina Berg)",female,27.0,0,2,347742,11.1333,,S,9,0
766,7670,0,1,"Brewe, Dr. Arthur Jackson",male,,0,0,112379,39.6,,C,7,670
683,6840,0,3,"Goodwin, Mr. Charles Edward",male,14.0,5,2,CA 2144,46.9,,S,6,840
874,8750,1,2,"Abelson, Mrs. Samuel (Hannah Wizosky)",female,28.0,1,0,P/PP 3381,24.0,,C,8,750
225,2260,0,3,"Berglund, Mr. Karl Ivar Sven",male,22.0,0,0,PP 4348,9.35,,S,2,260
248,2490,1,1,"Beckwith, Mr. Richard Leonard",male,37.0,1,1,11751,52.5542,D35,S,2,490
592,5930,0,3,"Elsbury, Mr. William James",male,47.0,0,0,A/5 3902,7.25,,S,5,930
760,7610,0,3,"Garfirth, Mr. John",male,,0,0,358585,14.5,,S,7,610
342,3430,0,2,"Collander, Mr. Erik Gustaf",male,28.0,0,0,248740,13.0,,S,3,430
595,5960,0,3,"Van Impe, Mr. Jean Baptiste",male,36.0,1,1,345773,24.15,,S,5,960
762,7630,1,3,"Barah, Mr. Hanna Assi",male,20.0,0,0,2663,7.2292,,C,7,630
15,160,1,2,"Hewlett, Mrs. (Mary D Kingcome) ",female,55.0,0,0,248706,16.0,,S,1,60
229,2300,0,3,"Lefebre, Miss. Mathilde",female,,3,1,4133,25.4667,,S,2,300
243,2440,0,3,"Maenpaa, Mr. Matti Alexanteri",male,22.0,0,0,STON/O 2. 3101275,7.125,,S,2,440
772,7730,0,2,"Mack, Mrs. (Mary)",female,57.0,0,0,S.O./P.P. 3,10.5,E77,S,7,730
477,4780,0,3,"Braund, Mr. Lewis Richard",male,29.0,1,0,3460,7.0458,,S,4,780
69,700,0,3,"Kink, Mr. Vincenz",male,26.0,2,0,315151,8.6625,,S,7,00
563,5640,0,3,"Simmons, Mr. John",male,,0,0,SOTON/OQ 392082,8.05,,S,5,640
577,5780,1,1,"Silvey, Mrs. William Baird (Alice Munger)",female,39.0,1,0,13507,55.9,E44,S,5,780
519,5200,0,3,"Pavlovic, Mr. Stefo",male,32.0,0,0,349242,7.8958,,S,5,200
79,800,1,3,"Dowdell, Miss. Elizabeth",female,30.0,0,0,364516,12.475,,S,8,00
61,620,1,1,"Icard, Miss. Amelie",female,38.0,0,0,113572,80.0,B28,,6,20
738,7390,0,3,"Ivanoff, Mr. Kanio",male,,0,0,349201,7.8958,,S,7,390
786,7870,1,3,"Sjoblom, Miss. Anna Sofia",female,18.0,0,0,3101265,7.4958,,S,7,870
615,6160,1,2,"Herman, Miss. Alice",female,24.0,1,2,220845,65.0,,S,6,160
10,110,1,3,"Sandstrom, Miss. Marguerite Rut",female,4.0,1,1,PP 9549,16.7,G6,S,1,10
376,3770,1,3,"Landergren, Miss. Aurora Adelia",female,22.0,0,0,C 7077,7.25,,S,3,770
28,290,1,3,"O'Dwyer, Miss. Ellen ""Nellie""",female,,0,0,330959,7.8792,,Q,2,90
398,3990,0,2,"Pain, Dr. Alfred",male,23.0,0,0,244278,10.5,,S,3,990
688,6890,0,3,"Fischer, Mr. Eberhard Thelander",male,18.0,0,0,350036,7.7958,,S,6,890
270,2710,0,1,"Cairns, Mr. Alexander",male,,0,0,113798,31.0,,S,2,710
881,8820,0,3,"Markun, Mr. Johann",male,33.0,0,0,349257,7.8958,,S,8,820
237,2380,1,2,"Collyer, Miss. Marjorie ""Lottie""",female,8.0,0,2,C.A. 31921,26.25,,S,2,380
0,10,0,3,"Braund, Mr. Owen Harris",male,22.0,1,0,A/5 21171,7.25,,S,1,0
572,5730,1,1,"Flynn, Mr. John Irwin (""Irving"")",male,36.0,0,0,PC 17474,26.3875,E25,S,5,730
666,6670,0,2,"Butler, Mr. Reginald Fenton",male,25.0,0,0,234686,13.0,,S,6,670
283,2840,1,3,"Dorking, Mr. Edward Arthur",male,19.0,0,0,A/5. 10482,8.05,,S,2,840
888,8890,0,3,"Johnston, Miss. Catherine Helen ""Carrie""",female,,1,2,W./C. 6607,23.45,,S,8,890
390,3910,1,1,"Carter, Mr. William Ernest",male,36.0,1,2,113760,120.0,B96 B98,S,3,910
529,5300,0,2,"Hocking, Mr. Richard George",male,23.0,2,1,29104,11.5,,S,5,300
567,5680,0,3,"Palsson, Mrs. Nils (Alma Cornelia Berglund)",female,29.0,0,4,349909,21.075,,S,5,680
172,1730,1,3,"Johnson, Miss. Eleanor Ileen",female,1.0,1,1,347742,11.1333,,S,1,730
847,8480,0,3,"Markoff, Mr. Marin",male,35.0,0,0,349213,7.8958,,C,8,480
117,1180,0,2,"Turpin, Mr. William John Robert",male,29.0,1,0,11668,21.0,,S,1,180
236,2370,0,2,"Hold, Mr. Stephen",male,44.0,1,0,26707,26.0,,S,2,370
741,7420,0,1,"Cavendish, Mr. Tyrell William",male,36.0,1,0,19877,78.85,C46,S,7,420
601,6020,0,3,"Slabenoff, Mr. Petco",male,,0,0,349214,7.8958,,S,6,020
825,8260,0,3,"Flynn, Mr. John",male,,0,0,368323,6.95,,Q,8,260
391,3920,1,3,"Jansson, Mr. Carl Olof",male,21.0,0,0,350034,7.7958,,S,3,920
282,2830,0,3,"de Pelsmaeker, Mr. Alfons",male,16.0,0,0,345778,9.5,,S,2,830
720,7210,1,2,"Harper, Miss. Annie Jessie ""Nina""",female,6.0,0,1,248727,33.0,,S,7,210
429,4300,1,3,"Pickard, Mr. Berk (Berk Trembisky)",male,32.0,0,0,SOTON/O.Q. 392078,8.05,E10,S,4,300
822,8230,0,1,"Reuchlin, Jonkheer. John George",male,38.0,0,0,19972,0.0,,S,8,230
312,3130,0,2,"Lahtinen, Mrs. William (Anna Sylfven)",female,26.0,1,1,250651,26.0,,S,3,130
496,4970,1,1,"Eustis, Miss. Elizabeth Mussey",female,54.0,1,0,36947,78.2667,D20,C,4,970
185,1860,0,1,"Rood, Mr. Hugh Roscoe",male,,0,0,113767,50.0,A32,S,1,860
30,310,0,1,"Uruchurtu, Don. Manuel E",male,40.0,0,0,PC 17601,27.7208,,C,3,10
288,2890,1,2,"Hosono, Mr. Masabumi",male,42.0,0,0,237798,13.0,,S,2,890
281,2820,0,3,"Olsson, Mr. Nils Johan Goransson",male,28.0,0,0,347464,7.8542,,S,2,820
3,40,1,1,"Futrelle, Mrs. Jacques Heath (Lily May Peel)",female,35.0,1,0,113803,53.1,C123,S,4,0
371,3720,0,3,"Wiklund, Mr. Jakob Alfred",male,18.0,1,0,3101267,6.4958,,S,3,720
834,8350,0,3,"Allum, Mr. Owen George",male,18.0,0,0,2223,8.3,,S,8,350
182,1830,0,3,"Asplund, Master. Clarence Gustaf Hugo",male,9.0,4,2,347077,31.3875,,S,1,830
189,1900,0,3,"Turcin, Mr. Stjepan",male,36.0,0,0,349247,7.8958,,S,1,900
642,6430,0,3,"Skoog, Miss. Margit Elizabeth",female,2.0,3,2,347088,27.9,,S,6,430
884,8850,0,3,"Sutehall, Mr. Henry Jr",male,25.0,0,0,SOTON/OQ 392076,7.05,,S,8,850
582,5830,0,2,"Downton, Mr. William James",male,54.0,0,0,28403,26.0,,S,5,830
147,1480,0,3,"Ford, Miss. Robina Maggie ""Ruby""",female,9.0,2,2,W./C. 6608,34.375,,S,1,480
630,6310,1,1,"Barkworth, Mr. Algernon Henry Wilson",male,80.0,0,0,27042,30.0,A23,S,6,310
609,6100,1,1,"Shutes, Miss. Elizabeth W",female,40.0,0,0,PC 17582,153.4625,C125,S,6,100
